

============================================================
Query: google
Time: 2026-02-06T19:05:11.762878
Candidates: 5
============================================================

--- [Doc #1] ---
[Metadata]
App: Google Chrome
Title: MyRecall
Time: Friday, 2026-02-06 19:04

[Visual Context]
Scene: coding
Summary: The screen shows the MyRecall application interface, which is a recall or memory assistant tool that captures and organizes browsing activity. The interface displays four recent activity cards, each timestamped and showing a screenshot of the user's browser state. Two activities are marked as 'Completed', one as 'Processing', and one as 'Pending'. The most recent card on the right shows a Google Gemini AI interface analyzing a document titled 'MyRecall-v3 Phase 0 计划深度解析'. The user's browser tab shows they are on a local server at '127.0.0.1:18083', indicating a development or testing environment.

[OCR Content]
MyRe X Xinm X Mode X Silico X Budg X Budg X Copil X - Goog X MiniM X HALYAL X RE X HTANE X NTANE X + 
< > 
127.0.0.1:18083 
A tA 
L 
p 
EB * Google Gemini GitHub LEERENTI ERYN.. D YouTube 09909 ( )P.. L& VIA Docs RaycastifilGZie (... **aL**WebV.. ChatGPT NotebookLM 
MyRecall 
BB III Q 
Completed 2 Processing 1 Pending 1 
Google Chrome 
2026-02-06 19:03:41 Google Chrome 
2026-02-06 19:03:20 Google Chrome 
2026-02-06 19:02:59 Google Chrome 
2026-02-06 19:02:37 
LE 
LE 
19:03 
: 
Pending... 
Processing... 
# The user is viewing the MyRecall application, 
* APIEELAGogle Gemini AIBIFEET* 
which is summarizing or analyzing a recent... 
F'MyRecall-v3 Phase 0 itXIRE# AAT'ENH, 


-------------------

--- [Doc #2] ---
[Metadata]
App: Google Chrome
Title: MyRecall
Time: Friday, 2026-02-06 19:03

[Visual Context]
Scene: coding
Summary: The user is viewing a MyRecall application interface that logs and summarizes past browser sessions. The current view shows two entries: one completed session with a screenshot of the MyRecall interface, and one active processing session from 19:02:37. This active entry contains a screenshot of a Google Chrome window showing a Google Gemini AI chat with a technical analysis of 'MyRecall-v3 Phase 0 计划深度解析', detailing 'Dormant Changes' like empty database tables and unused API features. The user appears to be reviewing or analyzing this technical report.

[OCR Content]
MyRe X Xinm X Mode X Silico X Budg X Budg X Copil X - Goog X MiniM X HALYAL 
RE X HTANE X NTANE X + 
< > 
127.0.0.1:18083 
A tA 
L 
p 
EB * Google Gemini GitHub LEERENTI ERYN.. D YouTube 09909 ( )P.. L& VIA Docs RaycastifilGZie (... **aL**WebV.. ChatGPT NotebookLM 
MyRecall 
BB III Q 
Completed 1 Processing 1 Pending 0 
Google Chrome 
2026-02-06 19:02:59 
Google Chrome 
2026-02-06 19:02:37 
peounx Oxex MAN Bud Oud +Come 
LE 
Processing... 
et BPIEELERGogle Gemini AIBITESE 1* 
F'MyRecall-v3 Phase 0 it&LERE DE IT'RIN, iz 
X 17 THI HTYBUHRAPTERTERINE 
(Dormant Changes), BARKERNENIERE 
(ÉDvideo_chunks, frames*) FIAPI v1832 
STEL XEMMBERE N HP 
FR NIXTAFERATAME, HP11 y 1 t 
AXXAXAX NT XE 


-------------------

--- [Doc #3] ---
[Metadata]
App: Google Chrome
Title: MyRecall
Time: Friday, 2026-02-06 19:02

[Visual Context]
Scene: coding
Summary: The user is viewing the MyRecall application, which is summarizing or analyzing a recent Google Chrome session. The interface displays a single entry under 'Processing' status, dated February 6, 2026, at 19:02:37, showing a screenshot of a Gemini AI chat session discussing technical details about MyRecall-v3 Phase 0. The user appears to be reviewing or managing AI-generated summaries of their browsing activity.

[OCR Content]
MyRe X Xinm X Mode X Silico X Budg X Budg X Copil X - Goog X MiniM X HALYAL 
RE X HTANE X NTANE X + 
< > 
127.0.0.1:18083 
A tA 
L 
p 
EB * Google Gemini GitHub LEERENTI ERYN.. D YouTube 09909 ( )P.. L& VIA Docs RaycastifilGZie (... **aL**WebV.. ChatGPT NotebookLM 
MyRecall 
BB III Q 
Completed 0 Processing 1 Pending 0 
Google Chrome 
2026-02-06 19:02:37 
Processing. 


-------------------

--- [Doc #4] ---
[Metadata]
App: Google Chrome
Title: MyRecall
Time: Friday, 2026-02-06 19:03

[Visual Context]
Scene: coding
Summary: The user is viewing a timeline interface of a tool called 'MyRecall', which captures and displays historical browser activity. The timeline is set to a specific date and time, 2026-02-06 19:03:20, and shows two entries: one marked as 'Processing...' and another with a detailed description in Chinese. The description explains that the user was using Google Gemini AI to review a technical document about 'MyRecall-v3 Phase 0' project, analyzing dormant changes including new database tables and API v1 features that are currently unused. The user appears to be reviewing or auditing this technical report. The interface is in grid view, and the browser has multiple tabs open, including GitHub and other development-related sites.

[OCR Content]
Timel X Xinm X Mode X Silico X Budg X Budg X Copil X - Goog X MiniM X HALYAL 
RE X HTANE X NTANE X t 
< > 
127.0.0.1:18083/timeline 
A tA 
- 
P 
EB + Google Gemini GitHub LEERENTI ERYN... D YouTube 09909 ( )P.. L& VIA Docs RaycastifilGZie (... **EL**WebV.. ChatGPT NotebookLM 
MyRecall 
BB III Q 
Grid' View 
2026-02-06 19:03:20 
S MyRe Xinm Mode Silico Budg udg Copil 
Minit #REVET WA 
C 0 127.0.0.1:18083 
GitHub J IERIERT EKHN. ouTube 400400 
: VIA E Docs Raycast tiff FREZE C **EI** 5 ChatGPT 
MyRecall 
Completed Processing Pending 0 
Google Chrome 
Google Chrome 
cunu 
: 
Processing. 
HPIEERGAGogle Gemini AIBIFET - * 
F'MyRecall-v3 Phase 0 HEURESURUFOSSES, it 
XH*ESIT TTHNISOOGENTINERE 
(Dormant Changes), BHETTHEN 
(Rivideo_chunks, frames FIAPI IV1893E04019 
SDEH, REMEREREEH*EEREMER, BP 
RELT THEMERNE, BPATERNESTH 
BEXTHE*SIRE. 


-------------------

--- [Doc #5] ---
[Metadata]
App: Google Chrome
Title: Google Gemini
Time: Friday, 2026-02-06 19:02

[Visual Context]
Scene: coding
Summary: 用户正在使用Google Gemini AI助手查看一个关于'MyRecall-v3 Phase 0 计划深度解析'的文档，该文档详细分析了当前版本中存在的“休眠变更”（Dormant Changes），包括五张空的数据库新表（如video_chunks, frames等）和API v1的高级特性分页逻辑，这些功能虽已开发但目前未被使用。用户界面显示了对话历史和输入框，用户似乎在阅读或审阅这份技术分析报告。

[OCR Content]
MyRe X Xinm X Mode X Silico X Budg X Budg X Copil X Goog X MiniM X ABEXHAL 
RE X HTANE X NTANE X + 
< > - -o gemini.google.com/appp/6cc1bcbb3338b4a8 
A tA 
- 
p 
EB * Google Gemini GitHub LEERENTI ERTN.. a YouTube : negneng ( - )P... L& VIA Docs RaycastifilGZie (... **EL**WebV. ChatGPT NotebookLM 
Q Gemini 
MyRecall-v3 Phase 0 ITXL 
V 
PRO P 
L RENTXTE 
L.3 
E ERA 
2. ItHETEBMBATERT 'ATERT (Dormant Changes) 
Gem 
IX: EEREATRKINMHENNTERG, VATVETER LE EXEXLNT, BEERTESEAP 
 
XTE 
A. THKESSURENTANTE 
Minimax PEEMAP DAM 
HITAISE video_chunks, frames, ocr_text (*T*), audio_chunks, 
MyRecall-v3 Phase 0 itXINT 
audio_transcriptions o 
HETASKENSRAXXEIT 
HE: Phase 0 #94EEATERATENTNO videolaudio recording". 
Sprint 1-2 AFRET LEETE 
JOX: X LO RIMELRITG, BITEITE 0. 
Mac E* Claude Code HA 
B. API v18352 
RL: XM5105 
HEX: /api/v1/* FASSDE (limit/offset). 
MyRecall Chat DHERIRALLINU 
ER: Web UI TEASEUPS (No Web UI changes), 
MyRecall Chat That Roadmap HUEU 
IT*R: VARNDIAIBULTATAHIEL (% E ETTT L HFF) TREDDE, ALLARES 
BREEREN, ATRATATTATISTTAST N 
#-EIRT: MISHADOLET 
Roadmap ASTERSEE 
C. #XBRANT 
Git Worktree: FEST 
(giq Gemini 3 
*****EResi** 
+ -o IA 
Pro V 0 
LEALABD 
Gemini BOPERETATIA, HIERE 


-------------------


============================================================
Query: gemini
Time: 2026-02-06T19:05:24.348442
Candidates: 5
============================================================

--- [Doc #1] ---
[Metadata]
App: Google Chrome
Title: Google Gemini
Time: Friday, 2026-02-06 19:02

[Visual Context]
Scene: coding
Summary: 用户正在使用Google Gemini AI助手查看一个关于'MyRecall-v3 Phase 0 计划深度解析'的文档，该文档详细分析了当前版本中存在的“休眠变更”（Dormant Changes），包括五张空的数据库新表（如video_chunks, frames等）和API v1的高级特性分页逻辑，这些功能虽已开发但目前未被使用。用户界面显示了对话历史和输入框，用户似乎在阅读或审阅这份技术分析报告。

[OCR Content]
MyRe X Xinm X Mode X Silico X Budg X Budg X Copil X Goog X MiniM X ABEXHAL 
RE X HTANE X NTANE X + 
< > - -o gemini.google.com/appp/6cc1bcbb3338b4a8 
A tA 
- 
p 
EB * Google Gemini GitHub LEERENTI ERTN.. a YouTube : negneng ( - )P... L& VIA Docs RaycastifilGZie (... **EL**WebV. ChatGPT NotebookLM 
Q Gemini 
MyRecall-v3 Phase 0 ITXL 
V 
PRO P 
L RENTXTE 
L.3 
E ERA 
2. ItHETEBMBATERT 'ATERT (Dormant Changes) 
Gem 
IX: EEREATRKINMHENNTERG, VATVETER LE EXEXLNT, BEERTESEAP 
 
XTE 
A. THKESSURENTANTE 
Minimax PEEMAP DAM 
HITAISE video_chunks, frames, ocr_text (*T*), audio_chunks, 
MyRecall-v3 Phase 0 itXINT 
audio_transcriptions o 
HETASKENSRAXXEIT 
HE: Phase 0 #94EEATERATENTNO videolaudio recording". 
Sprint 1-2 AFRET LEETE 
JOX: X LO RIMELRITG, BITEITE 0. 
Mac E* Claude Code HA 
B. API v18352 
RL: XM5105 
HEX: /api/v1/* FASSDE (limit/offset). 
MyRecall Chat DHERIRALLINU 
ER: Web UI TEASEUPS (No Web UI changes), 
MyRecall Chat That Roadmap HUEU 
IT*R: VARNDIAIBULTATAHIEL (% E ETTT L HFF) TREDDE, ALLARES 
BREEREN, ATRATATTATISTTAST N 
#-EIRT: MISHADOLET 
Roadmap ASTERSEE 
C. #XBRANT 
Git Worktree: FEST 
(giq Gemini 3 
*****EResi** 
+ -o IA 
Pro V 0 
LEALABD 
Gemini BOPERETATIA, HIERE 


-------------------

--- [Doc #2] ---
[Metadata]
App: Google Chrome
Title: MyRecall
Time: Friday, 2026-02-06 19:03

[Visual Context]
Scene: coding
Summary: The user is viewing a MyRecall application interface that logs and summarizes past browser sessions. The current view shows two entries: one completed session with a screenshot of the MyRecall interface, and one active processing session from 19:02:37. This active entry contains a screenshot of a Google Chrome window showing a Google Gemini AI chat with a technical analysis of 'MyRecall-v3 Phase 0 计划深度解析', detailing 'Dormant Changes' like empty database tables and unused API features. The user appears to be reviewing or analyzing this technical report.

[OCR Content]
MyRe X Xinm X Mode X Silico X Budg X Budg X Copil X - Goog X MiniM X HALYAL 
RE X HTANE X NTANE X + 
< > 
127.0.0.1:18083 
A tA 
L 
p 
EB * Google Gemini GitHub LEERENTI ERYN.. D YouTube 09909 ( )P.. L& VIA Docs RaycastifilGZie (... **aL**WebV.. ChatGPT NotebookLM 
MyRecall 
BB III Q 
Completed 1 Processing 1 Pending 0 
Google Chrome 
2026-02-06 19:02:59 
Google Chrome 
2026-02-06 19:02:37 
peounx Oxex MAN Bud Oud +Come 
LE 
Processing... 
et BPIEELERGogle Gemini AIBITESE 1* 
F'MyRecall-v3 Phase 0 it&LERE DE IT'RIN, iz 
X 17 THI HTYBUHRAPTERTERINE 
(Dormant Changes), BARKERNENIERE 
(ÉDvideo_chunks, frames*) FIAPI v1832 
STEL XEMMBERE N HP 
FR NIXTAFERATAME, HP11 y 1 t 
AXXAXAX NT XE 


-------------------

--- [Doc #3] ---
[Metadata]
App: Google Chrome
Title: MyRecall
Time: Friday, 2026-02-06 19:04

[Visual Context]
Scene: coding
Summary: The screen shows the MyRecall application interface, which is a recall or memory assistant tool that captures and organizes browsing activity. The interface displays four recent activity cards, each timestamped and showing a screenshot of the user's browser state. Two activities are marked as 'Completed', one as 'Processing', and one as 'Pending'. The most recent card on the right shows a Google Gemini AI interface analyzing a document titled 'MyRecall-v3 Phase 0 计划深度解析'. The user's browser tab shows they are on a local server at '127.0.0.1:18083', indicating a development or testing environment.

[OCR Content]
MyRe X Xinm X Mode X Silico X Budg X Budg X Copil X - Goog X MiniM X HALYAL X RE X HTANE X NTANE X + 
< > 
127.0.0.1:18083 
A tA 
L 
p 
EB * Google Gemini GitHub LEERENTI ERYN.. D YouTube 09909 ( )P.. L& VIA Docs RaycastifilGZie (... **aL**WebV.. ChatGPT NotebookLM 
MyRecall 
BB III Q 
Completed 2 Processing 1 Pending 1 
Google Chrome 
2026-02-06 19:03:41 Google Chrome 
2026-02-06 19:03:20 Google Chrome 
2026-02-06 19:02:59 Google Chrome 
2026-02-06 19:02:37 
LE 
LE 
19:03 
: 
Pending... 
Processing... 
# The user is viewing the MyRecall application, 
* APIEELAGogle Gemini AIBIFEET* 
which is summarizing or analyzing a recent... 
F'MyRecall-v3 Phase 0 itXIRE# AAT'ENH, 


-------------------

--- [Doc #4] ---
[Metadata]
App: Google Chrome
Title: MyRecall
Time: Friday, 2026-02-06 19:03

[Visual Context]
Scene: coding
Summary: The user is viewing a timeline interface of a tool called 'MyRecall', which captures and displays historical browser activity. The timeline is set to a specific date and time, 2026-02-06 19:03:20, and shows two entries: one marked as 'Processing...' and another with a detailed description in Chinese. The description explains that the user was using Google Gemini AI to review a technical document about 'MyRecall-v3 Phase 0' project, analyzing dormant changes including new database tables and API v1 features that are currently unused. The user appears to be reviewing or auditing this technical report. The interface is in grid view, and the browser has multiple tabs open, including GitHub and other development-related sites.

[OCR Content]
Timel X Xinm X Mode X Silico X Budg X Budg X Copil X - Goog X MiniM X HALYAL 
RE X HTANE X NTANE X t 
< > 
127.0.0.1:18083/timeline 
A tA 
- 
P 
EB + Google Gemini GitHub LEERENTI ERYN... D YouTube 09909 ( )P.. L& VIA Docs RaycastifilGZie (... **EL**WebV.. ChatGPT NotebookLM 
MyRecall 
BB III Q 
Grid' View 
2026-02-06 19:03:20 
S MyRe Xinm Mode Silico Budg udg Copil 
Minit #REVET WA 
C 0 127.0.0.1:18083 
GitHub J IERIERT EKHN. ouTube 400400 
: VIA E Docs Raycast tiff FREZE C **EI** 5 ChatGPT 
MyRecall 
Completed Processing Pending 0 
Google Chrome 
Google Chrome 
cunu 
: 
Processing. 
HPIEERGAGogle Gemini AIBIFET - * 
F'MyRecall-v3 Phase 0 HEURESURUFOSSES, it 
XH*ESIT TTHNISOOGENTINERE 
(Dormant Changes), BHETTHEN 
(Rivideo_chunks, frames FIAPI IV1893E04019 
SDEH, REMEREREEH*EEREMER, BP 
RELT THEMERNE, BPATERNESTH 
BEXTHE*SIRE. 


-------------------

--- [Doc #5] ---
[Metadata]
App: Google Chrome
Title: MyRecall
Time: Friday, 2026-02-06 19:02

[Visual Context]
Scene: coding
Summary: The user is viewing the MyRecall application, which is summarizing or analyzing a recent Google Chrome session. The interface displays a single entry under 'Processing' status, dated February 6, 2026, at 19:02:37, showing a screenshot of a Gemini AI chat session discussing technical details about MyRecall-v3 Phase 0. The user appears to be reviewing or managing AI-generated summaries of their browsing activity.

[OCR Content]
MyRe X Xinm X Mode X Silico X Budg X Budg X Copil X - Goog X MiniM X HALYAL 
RE X HTANE X NTANE X + 
< > 
127.0.0.1:18083 
A tA 
L 
p 
EB * Google Gemini GitHub LEERENTI ERYN.. D YouTube 09909 ( )P.. L& VIA Docs RaycastifilGZie (... **aL**WebV.. ChatGPT NotebookLM 
MyRecall 
BB III Q 
Completed 0 Processing 1 Pending 0 
Google Chrome 
2026-02-06 19:02:37 
Processing. 


-------------------


============================================================
Query: test
Time: 2026-02-06T19:42:50.794308
Candidates: 4
============================================================

--- [Doc #1] ---
[Metadata]
App: Codex
Title: Codex
Time: Friday, 2026-02-06 19:41

[Visual Context]
Scene: coding
Summary: The screen displays a development environment interface where a user is executing a phased testing process. The interface shows server/client logs indicating both are running, followed by Chinese text detailing an automated plan to run 8 pytest suites in sequence, with failure analysis. It logs commands that source a conda environment, activate 'v3', and run pytest tests on 'test_phase0_gates.py'. The output shows test collection and initial test names. The bottom includes an input field for follow-up changes and model configuration options. The user's intent is to systematically execute and validate a testing workflow.

[OCR Content]
- Execute Phase 0 fix-until-go process new 
Open V - Commit V 
E 
19:40:42 INFO openrecall.client I Capture interval: 20s 
Last turn changes V D 
19:40:42 INFO openrecall.client I Upload timeout: 180s 
19:40:42 INFO openrecall.client I Primary monitor only: True 
19:40:42 INFO openrecall.client I = 
19:40:42 INFO openrecall.client.consumer I : Consumer started I Pending uploads: 0 
19:40:42 INFO openrecall.client.recorder RE Recorder started (Producer-Consumer mode) 
NESEEDED (server/client ITTIAT). EGRAMEAT 8 A pytest, HREEAAR: EHTIEIN, ELTEIN 
RERTESTAL 
Ran source "$(conda info --base)/etc/protile. .d/conda. sh" &t& conda activate v3. && cd, Users/pyw/new/MyMyRecall &8&... 
Ran source "$(conda info -base)/etc/profile. .d/conda. .sh" && conda activate v3 && cd, Users/pyw/new/MyMyRecall &8&... 
Ran source "$(conda info -base)/etc/profile.d/conda. .sh" && conda activate v3 && cd, Users/pyw/new/MyMyRecall &8&... 
AU-A Phase 0 EUTLILILISSISI ALXTELLATILRSE5E DEER API smoke (XXHRASERE5HD4). 
Ran source "$(conda info --base)/etc/profile.d/conda.sh" && conda activate v3 && cd/Users/pyw/new/MyRecall.&&.... 
Ran source "$(conda info --base)/etc/profile.d/conda.sh" &t& conda activate v3 && cd/Users/pyw/new/MyRecall.&&... 
Ran source "$(conda info --base)/etc/profile.d/conda.sh" && conda activate v3 && cd/Users/pyw/new/MyRecall.&&... 
File changes will appear he 
Running command for 1s 
or the latest diffs are no long 
available 
bash 
$ source "$(conda info --base)/etc/profile.d/conda.sh" &f conda activate v3 &&& cd 
/Users/pyw/new/MyRecall &&& pytest tests/test_phase0_gates.py -V 
configfile: pytest.ini 
plugins: anyio-4.12.1 
collecting collected 19 items 
tests/test_phase0_gates.py::Te les Gat 01Sc ne igrati Success::test_gate_F01_schema_migration_suce 
tests/test_phase0_gates.py::Tes 0. 2 ackw war r ou mpat: ity::test_gate_F02_backward_compatibilit: 
Ask for follow-up changes 
+ GPT-5.3-Codex Extra High V o- Plan 
Q 
Local V Full access V 
% master V 


-------------------

--- [Doc #2] ---
[Metadata]
App: Codex
Title: Codex
Time: Friday, 2026-02-06 19:41

[Visual Context]
Scene: coding
Summary: The screen shows a development environment where a user is executing a Phase 0 fix-until-go process. Terminal logs indicate server and client processes are running, showing API requests and upload completions. Chinese text confirms that the first three Phase 0 test cases have passed and the user plans to run the remaining tests and full regression. The interface is from a code editor or AI-assisted development tool, with options for model selection and plan execution.

[OCR Content]
Execute Phase 0 fix-until-go process new 
Open V - Commit V 
E 
Toggle sidebar 88B 
basi 
Last turn changes V D 
$ source "$(conda info --base)/etc/profile.d/conda.sh" && conda activate v3 &&& cd 
/Users/pyw/new/MyRecall &r& ./run_server.sh 
19:41:17 INFO werkzeug I 127.0.0.1 [06/Feb/2026 19:41:17] "GET /api/memories/recent7lir 
19:41:22 INFO werkzeug I 127.0.0.1 [06/Feb/2026 19:41:22] "GET /api/config HTTP/1.1" 21 
19:41:22 INFO werkzeug I 127.0.0.1 [06/Feb/2026 19:41:22] "GET /api/memories/latest?si 
19:41:22 INFO werkzeug 127.0.0.1 [06/Feb/2026 19:41:22] "GET /api/memories/recent7li 
19:41:22 INFO werkzeug I 127.0.0.1 [06/Feb/2026 19:41:22] "GET /api/memories/latest?si 
19:41:22 INFO werkzeug I 127.0.0.1 [06/Feb/2026 19:41:22] "GET /api/memories/recent?lir 
Running command for 41s 
bash 
$ source "$(conda info --base)/etc/profile.d/conda.sh" &c& conda activate v3 &&& cd 
/Users/pyw/new/MyRecall && ./run_client.sh 
19:40:42 INFO openrecall.client.recorder I Tracking 1 monitor(s) 
19:40:42 DEBUG openrecall.client.recorder I Heartbeat synced: recording=True, upload=True 
19:41:02 DEBUG openrecall.client.recorder I Heartbeat synced: recording=True, upload=True 
19:41:03 INFO openrecall.client.buffer a Buffered: Codex I Queue: 1 items 
19:41:03 INFO openrecall.client.consumer I a Uploaded: Codex I ts-1770378063 
19:41:03 INFO openrecall.client.buffer I M Committed: 20260206_194103.0238.. I Remaining: 
File changes will appear he 
or the latest diffs are no long 
NETEME (server/client HITET). EGEAMERTANTANT 8 A pytest, HRESAAR EHENKEN, EXTEL 
available 
REHTENTAL 
Ran source "$(conda info base)/etc/profile.d/conda.sh" &&& conda activate v3 &&& cd, /Usersipwlnew/MyRecall &&&... 
Ran source "$(conda info base)/etc/profile.d/conda.sh" &&& conda activate v3. &&& cd, /Usersipwlnew/MyRecall &&&... 
Ran source "$(conda info base)/etc/profile.d/conda.sh" &t& conda activate v3. &t& cd, /Usersipwlnew/MyRecall &&&... 
AIE Phase 0 EUTLILILL ALINTETITESTTO 
Thinking 
Ask for follow-up changes 
+ GPT-5.3-Codex Extra High V o- Plan 
Q 
Local V Full access V 
% master V 


-------------------

--- [Doc #3] ---
[Metadata]
App: Google Chrome
Title: MyRecall
Time: Friday, 2026-02-06 19:04

[Visual Context]
Scene: coding
Summary: The screen shows the MyRecall application interface, which is a recall or memory assistant tool that captures and organizes browsing activity. The interface displays four recent activity cards, each timestamped and showing a screenshot of the user's browser state. Two activities are marked as 'Completed', one as 'Processing', and one as 'Pending'. The most recent card on the right shows a Google Gemini AI interface analyzing a document titled 'MyRecall-v3 Phase 0 计划深度解析'. The user's browser tab shows they are on a local server at '127.0.0.1:18083', indicating a development or testing environment.

[OCR Content]
MyRe X Xinm X Mode X Silico X Budg X Budg X Copil X - Goog X MiniM X HALYAL X RE X HTANE X NTANE X + 
< > 
127.0.0.1:18083 
A tA 
L 
p 
EB * Google Gemini GitHub LEERENTI ERYN.. D YouTube 09909 ( )P.. L& VIA Docs RaycastifilGZie (... **aL**WebV.. ChatGPT NotebookLM 
MyRecall 
BB III Q 
Completed 2 Processing 1 Pending 1 
Google Chrome 
2026-02-06 19:03:41 Google Chrome 
2026-02-06 19:03:20 Google Chrome 
2026-02-06 19:02:59 Google Chrome 
2026-02-06 19:02:37 
LE 
LE 
19:03 
: 
Pending... 
Processing... 
# The user is viewing the MyRecall application, 
* APIEELAGogle Gemini AIBIFEET* 
which is summarizing or analyzing a recent... 
F'MyRecall-v3 Phase 0 itXIRE# AAT'ENH, 


-------------------

--- [Doc #4] ---
[Metadata]
App: Google Chrome
Title: MyRecall
Time: Friday, 2026-02-06 19:03

[Visual Context]
Scene: coding
Summary: The user is viewing a MyRecall application interface that logs and summarizes past browser sessions. The current view shows two entries: one completed session with a screenshot of the MyRecall interface, and one active processing session from 19:02:37. This active entry contains a screenshot of a Google Chrome window showing a Google Gemini AI chat with a technical analysis of 'MyRecall-v3 Phase 0 计划深度解析', detailing 'Dormant Changes' like empty database tables and unused API features. The user appears to be reviewing or analyzing this technical report.

[OCR Content]
MyRe X Xinm X Mode X Silico X Budg X Budg X Copil X - Goog X MiniM X HALYAL 
RE X HTANE X NTANE X + 
< > 
127.0.0.1:18083 
A tA 
L 
p 
EB * Google Gemini GitHub LEERENTI ERYN.. D YouTube 09909 ( )P.. L& VIA Docs RaycastifilGZie (... **aL**WebV.. ChatGPT NotebookLM 
MyRecall 
BB III Q 
Completed 1 Processing 1 Pending 0 
Google Chrome 
2026-02-06 19:02:59 
Google Chrome 
2026-02-06 19:02:37 
peounx Oxex MAN Bud Oud +Come 
LE 
Processing... 
et BPIEELERGogle Gemini AIBITESE 1* 
F'MyRecall-v3 Phase 0 it&LERE DE IT'RIN, iz 
X 17 THI HTYBUHRAPTERTERINE 
(Dormant Changes), BARKERNENIERE 
(ÉDvideo_chunks, frames*) FIAPI v1832 
STEL XEMMBERE N HP 
FR NIXTAFERATAME, HP11 y 1 t 
AXXAXAX NT XE 


-------------------


============================================================
Query: test
Time: 2026-02-06T19:42:52.597465
Candidates: 4
============================================================

--- [Doc #1] ---
[Metadata]
App: Codex
Title: Codex
Time: Friday, 2026-02-06 19:41

[Visual Context]
Scene: coding
Summary: The screen displays a development environment interface where a user is executing a phased testing process. The interface shows server/client logs indicating both are running, followed by Chinese text detailing an automated plan to run 8 pytest suites in sequence, with failure analysis. It logs commands that source a conda environment, activate 'v3', and run pytest tests on 'test_phase0_gates.py'. The output shows test collection and initial test names. The bottom includes an input field for follow-up changes and model configuration options. The user's intent is to systematically execute and validate a testing workflow.

[OCR Content]
- Execute Phase 0 fix-until-go process new 
Open V - Commit V 
E 
19:40:42 INFO openrecall.client I Capture interval: 20s 
Last turn changes V D 
19:40:42 INFO openrecall.client I Upload timeout: 180s 
19:40:42 INFO openrecall.client I Primary monitor only: True 
19:40:42 INFO openrecall.client I = 
19:40:42 INFO openrecall.client.consumer I : Consumer started I Pending uploads: 0 
19:40:42 INFO openrecall.client.recorder RE Recorder started (Producer-Consumer mode) 
NESEEDED (server/client ITTIAT). EGRAMEAT 8 A pytest, HREEAAR: EHTIEIN, ELTEIN 
RERTESTAL 
Ran source "$(conda info --base)/etc/protile. .d/conda. sh" &t& conda activate v3. && cd, Users/pyw/new/MyMyRecall &8&... 
Ran source "$(conda info -base)/etc/profile. .d/conda. .sh" && conda activate v3 && cd, Users/pyw/new/MyMyRecall &8&... 
Ran source "$(conda info -base)/etc/profile.d/conda. .sh" && conda activate v3 && cd, Users/pyw/new/MyMyRecall &8&... 
AU-A Phase 0 EUTLILILISSISI ALXTELLATILRSE5E DEER API smoke (XXHRASERE5HD4). 
Ran source "$(conda info --base)/etc/profile.d/conda.sh" && conda activate v3 && cd/Users/pyw/new/MyRecall.&&.... 
Ran source "$(conda info --base)/etc/profile.d/conda.sh" &t& conda activate v3 && cd/Users/pyw/new/MyRecall.&&... 
Ran source "$(conda info --base)/etc/profile.d/conda.sh" && conda activate v3 && cd/Users/pyw/new/MyRecall.&&... 
File changes will appear he 
Running command for 1s 
or the latest diffs are no long 
available 
bash 
$ source "$(conda info --base)/etc/profile.d/conda.sh" &f conda activate v3 &&& cd 
/Users/pyw/new/MyRecall &&& pytest tests/test_phase0_gates.py -V 
configfile: pytest.ini 
plugins: anyio-4.12.1 
collecting collected 19 items 
tests/test_phase0_gates.py::Te les Gat 01Sc ne igrati Success::test_gate_F01_schema_migration_suce 
tests/test_phase0_gates.py::Tes 0. 2 ackw war r ou mpat: ity::test_gate_F02_backward_compatibilit: 
Ask for follow-up changes 
+ GPT-5.3-Codex Extra High V o- Plan 
Q 
Local V Full access V 
% master V 


-------------------

--- [Doc #2] ---
[Metadata]
App: Codex
Title: Codex
Time: Friday, 2026-02-06 19:41

[Visual Context]
Scene: coding
Summary: The screen shows a development environment where a user is executing a Phase 0 fix-until-go process. Terminal logs indicate server and client processes are running, showing API requests and upload completions. Chinese text confirms that the first three Phase 0 test cases have passed and the user plans to run the remaining tests and full regression. The interface is from a code editor or AI-assisted development tool, with options for model selection and plan execution.

[OCR Content]
Execute Phase 0 fix-until-go process new 
Open V - Commit V 
E 
Toggle sidebar 88B 
basi 
Last turn changes V D 
$ source "$(conda info --base)/etc/profile.d/conda.sh" && conda activate v3 &&& cd 
/Users/pyw/new/MyRecall &r& ./run_server.sh 
19:41:17 INFO werkzeug I 127.0.0.1 [06/Feb/2026 19:41:17] "GET /api/memories/recent7lir 
19:41:22 INFO werkzeug I 127.0.0.1 [06/Feb/2026 19:41:22] "GET /api/config HTTP/1.1" 21 
19:41:22 INFO werkzeug I 127.0.0.1 [06/Feb/2026 19:41:22] "GET /api/memories/latest?si 
19:41:22 INFO werkzeug 127.0.0.1 [06/Feb/2026 19:41:22] "GET /api/memories/recent7li 
19:41:22 INFO werkzeug I 127.0.0.1 [06/Feb/2026 19:41:22] "GET /api/memories/latest?si 
19:41:22 INFO werkzeug I 127.0.0.1 [06/Feb/2026 19:41:22] "GET /api/memories/recent?lir 
Running command for 41s 
bash 
$ source "$(conda info --base)/etc/profile.d/conda.sh" &c& conda activate v3 &&& cd 
/Users/pyw/new/MyRecall && ./run_client.sh 
19:40:42 INFO openrecall.client.recorder I Tracking 1 monitor(s) 
19:40:42 DEBUG openrecall.client.recorder I Heartbeat synced: recording=True, upload=True 
19:41:02 DEBUG openrecall.client.recorder I Heartbeat synced: recording=True, upload=True 
19:41:03 INFO openrecall.client.buffer a Buffered: Codex I Queue: 1 items 
19:41:03 INFO openrecall.client.consumer I a Uploaded: Codex I ts-1770378063 
19:41:03 INFO openrecall.client.buffer I M Committed: 20260206_194103.0238.. I Remaining: 
File changes will appear he 
or the latest diffs are no long 
NETEME (server/client HITET). EGEAMERTANTANT 8 A pytest, HRESAAR EHENKEN, EXTEL 
available 
REHTENTAL 
Ran source "$(conda info base)/etc/profile.d/conda.sh" &&& conda activate v3 &&& cd, /Usersipwlnew/MyRecall &&&... 
Ran source "$(conda info base)/etc/profile.d/conda.sh" &&& conda activate v3. &&& cd, /Usersipwlnew/MyRecall &&&... 
Ran source "$(conda info base)/etc/profile.d/conda.sh" &t& conda activate v3. &t& cd, /Usersipwlnew/MyRecall &&&... 
AIE Phase 0 EUTLILILL ALINTETITESTTO 
Thinking 
Ask for follow-up changes 
+ GPT-5.3-Codex Extra High V o- Plan 
Q 
Local V Full access V 
% master V 


-------------------

--- [Doc #3] ---
[Metadata]
App: Google Chrome
Title: MyRecall
Time: Friday, 2026-02-06 19:04

[Visual Context]
Scene: coding
Summary: The screen shows the MyRecall application interface, which is a recall or memory assistant tool that captures and organizes browsing activity. The interface displays four recent activity cards, each timestamped and showing a screenshot of the user's browser state. Two activities are marked as 'Completed', one as 'Processing', and one as 'Pending'. The most recent card on the right shows a Google Gemini AI interface analyzing a document titled 'MyRecall-v3 Phase 0 计划深度解析'. The user's browser tab shows they are on a local server at '127.0.0.1:18083', indicating a development or testing environment.

[OCR Content]
MyRe X Xinm X Mode X Silico X Budg X Budg X Copil X - Goog X MiniM X HALYAL X RE X HTANE X NTANE X + 
< > 
127.0.0.1:18083 
A tA 
L 
p 
EB * Google Gemini GitHub LEERENTI ERYN.. D YouTube 09909 ( )P.. L& VIA Docs RaycastifilGZie (... **aL**WebV.. ChatGPT NotebookLM 
MyRecall 
BB III Q 
Completed 2 Processing 1 Pending 1 
Google Chrome 
2026-02-06 19:03:41 Google Chrome 
2026-02-06 19:03:20 Google Chrome 
2026-02-06 19:02:59 Google Chrome 
2026-02-06 19:02:37 
LE 
LE 
19:03 
: 
Pending... 
Processing... 
# The user is viewing the MyRecall application, 
* APIEELAGogle Gemini AIBIFEET* 
which is summarizing or analyzing a recent... 
F'MyRecall-v3 Phase 0 itXIRE# AAT'ENH, 


-------------------

--- [Doc #4] ---
[Metadata]
App: Google Chrome
Title: MyRecall
Time: Friday, 2026-02-06 19:03

[Visual Context]
Scene: coding
Summary: The user is viewing a MyRecall application interface that logs and summarizes past browser sessions. The current view shows two entries: one completed session with a screenshot of the MyRecall interface, and one active processing session from 19:02:37. This active entry contains a screenshot of a Google Chrome window showing a Google Gemini AI chat with a technical analysis of 'MyRecall-v3 Phase 0 计划深度解析', detailing 'Dormant Changes' like empty database tables and unused API features. The user appears to be reviewing or analyzing this technical report.

[OCR Content]
MyRe X Xinm X Mode X Silico X Budg X Budg X Copil X - Goog X MiniM X HALYAL 
RE X HTANE X NTANE X + 
< > 
127.0.0.1:18083 
A tA 
L 
p 
EB * Google Gemini GitHub LEERENTI ERYN.. D YouTube 09909 ( )P.. L& VIA Docs RaycastifilGZie (... **aL**WebV.. ChatGPT NotebookLM 
MyRecall 
BB III Q 
Completed 1 Processing 1 Pending 0 
Google Chrome 
2026-02-06 19:02:59 
Google Chrome 
2026-02-06 19:02:37 
peounx Oxex MAN Bud Oud +Come 
LE 
Processing... 
et BPIEELERGogle Gemini AIBITESE 1* 
F'MyRecall-v3 Phase 0 it&LERE DE IT'RIN, iz 
X 17 THI HTYBUHRAPTERTERINE 
(Dormant Changes), BARKERNENIERE 
(ÉDvideo_chunks, frames*) FIAPI v1832 
STEL XEMMBERE N HP 
FR NIXTAFERATAME, HP11 y 1 t 
AXXAXAX NT XE 


-------------------


============================================================
Query: test
Time: 2026-02-06T19:50:50.643700
Candidates: 5
============================================================

--- [Doc #1] ---
[Metadata]
App: Codex
Title: Codex
Time: Friday, 2026-02-06 19:41

[Visual Context]
Scene: coding
Summary: The screen displays a development environment interface where a user is executing a phased testing process. The interface shows server/client logs indicating both are running, followed by Chinese text detailing an automated plan to run 8 pytest suites in sequence, with failure analysis. It logs commands that source a conda environment, activate 'v3', and run pytest tests on 'test_phase0_gates.py'. The output shows test collection and initial test names. The bottom includes an input field for follow-up changes and model configuration options. The user's intent is to systematically execute and validate a testing workflow.

[OCR Content]
- Execute Phase 0 fix-until-go process new 
Open V - Commit V 
E 
19:40:42 INFO openrecall.client I Capture interval: 20s 
Last turn changes V D 
19:40:42 INFO openrecall.client I Upload timeout: 180s 
19:40:42 INFO openrecall.client I Primary monitor only: True 
19:40:42 INFO openrecall.client I = 
19:40:42 INFO openrecall.client.consumer I : Consumer started I Pending uploads: 0 
19:40:42 INFO openrecall.client.recorder RE Recorder started (Producer-Consumer mode) 
NESEEDED (server/client ITTIAT). EGRAMEAT 8 A pytest, HREEAAR: EHTIEIN, ELTEIN 
RERTESTAL 
Ran source "$(conda info --base)/etc/protile. .d/conda. sh" &t& conda activate v3. && cd, Users/pyw/new/MyMyRecall &8&... 
Ran source "$(conda info -base)/etc/profile. .d/conda. .sh" && conda activate v3 && cd, Users/pyw/new/MyMyRecall &8&... 
Ran source "$(conda info -base)/etc/profile.d/conda. .sh" && conda activate v3 && cd, Users/pyw/new/MyMyRecall &8&... 
AU-A Phase 0 EUTLILILISSISI ALXTELLATILRSE5E DEER API smoke (XXHRASERE5HD4). 
Ran source "$(conda info --base)/etc/profile.d/conda.sh" && conda activate v3 && cd/Users/pyw/new/MyRecall.&&.... 
Ran source "$(conda info --base)/etc/profile.d/conda.sh" &t& conda activate v3 && cd/Users/pyw/new/MyRecall.&&... 
Ran source "$(conda info --base)/etc/profile.d/conda.sh" && conda activate v3 && cd/Users/pyw/new/MyRecall.&&... 
File changes will appear he 
Running command for 1s 
or the latest diffs are no long 
available 
bash 
$ source "$(conda info --base)/etc/profile.d/conda.sh" &f conda activate v3 &&& cd 
/Users/pyw/new/MyRecall &&& pytest tests/test_phase0_gates.py -V 
configfile: pytest.ini 
plugins: anyio-4.12.1 
collecting collected 19 items 
tests/test_phase0_gates.py::Te les Gat 01Sc ne igrati Success::test_gate_F01_schema_migration_suce 
tests/test_phase0_gates.py::Tes 0. 2 ackw war r ou mpat: ity::test_gate_F02_backward_compatibilit: 
Ask for follow-up changes 
+ GPT-5.3-Codex Extra High V o- Plan 
Q 
Local V Full access V 
% master V 


-------------------

--- [Doc #2] ---
[Metadata]
App: SmokeTestApp
Title: SmokeWindowV1
Time: Friday, 2026-02-06 19:43

[Visual Context]
Scene: general
Summary: 

[OCR Content]

-------------------

--- [Doc #3] ---
[Metadata]
App: SmokeTestApp
Title: SmokeWindow
Time: Friday, 2026-02-06 19:42

[Visual Context]
Scene: general
Summary: 

[OCR Content]

-------------------

--- [Doc #4] ---
[Metadata]
App: Google Chrome
Title: MyRecall
Time: Friday, 2026-02-06 19:04

[Visual Context]
Scene: coding
Summary: The screen shows the MyRecall application interface, which is a recall or memory assistant tool that captures and organizes browsing activity. The interface displays four recent activity cards, each timestamped and showing a screenshot of the user's browser state. Two activities are marked as 'Completed', one as 'Processing', and one as 'Pending'. The most recent card on the right shows a Google Gemini AI interface analyzing a document titled 'MyRecall-v3 Phase 0 计划深度解析'. The user's browser tab shows they are on a local server at '127.0.0.1:18083', indicating a development or testing environment.

[OCR Content]
MyRe X Xinm X Mode X Silico X Budg X Budg X Copil X - Goog X MiniM X HALYAL X RE X HTANE X NTANE X + 
< > 
127.0.0.1:18083 
A tA 
L 
p 
EB * Google Gemini GitHub LEERENTI ERYN.. D YouTube 09909 ( )P.. L& VIA Docs RaycastifilGZie (... **aL**WebV.. ChatGPT NotebookLM 
MyRecall 
BB III Q 
Completed 2 Processing 1 Pending 1 
Google Chrome 
2026-02-06 19:03:41 Google Chrome 
2026-02-06 19:03:20 Google Chrome 
2026-02-06 19:02:59 Google Chrome 
2026-02-06 19:02:37 
LE 
LE 
19:03 
: 
Pending... 
Processing... 
# The user is viewing the MyRecall application, 
* APIEELAGogle Gemini AIBIFEET* 
which is summarizing or analyzing a recent... 
F'MyRecall-v3 Phase 0 itXIRE# AAT'ENH, 


-------------------

--- [Doc #5] ---
[Metadata]
App: Codex
Title: Codex
Time: Friday, 2026-02-06 19:43

[Visual Context]
Scene: coding
Summary: The user is debugging a software issue in a coding environment, analyzing API test results that show inconsistencies between v1 and legacy endpoints (e.g., 405 and 400 errors). They've determined the problem is a testing API call mismatch, not a gate failure, and plan to use correct contracts to rerun tests. They also identified a 409 error from a duplicate timestamp in upload_v1 and plan to fix it by uploading with a unique timestamp and later extract gate definitions from test_phase0_gates.py to create a repair checklist. The interface shows executed commands, success indicators, and a thinking section for planning next steps.

[OCR Content]
- Execute Phase 0 fix-until-go process new 
Open V - Commit V 
E 
sers/pyw/ new/MyRecal da python << PY 
Last turn changes V D 
"json_object": true, 
"has_status_or_ok": true 
} 
}, 
i 
"name": "health_v1", 
Hurlu. "httn.//127 a a 1. 18 2082 V 11 h 
JS Success 
ANPRMEN***S: search HER 405, upload ixp 400, /memories/recent ANTENE v1/legacy Zith 
T-EX. F-SRAMENTH API X151111 MAXETSEBRMETATITEKERTASENRA 
Explored 3 files 
CMAXENBISHBE TEYAT gate AIk: search E GET, upload ME file+metadata o LAMHEA 
REVERENTAU, ##4108 legacy/v1 MSTERTE. 
Ran command for 4s 
bash 
$ source "$(conda info --base)/etc/profile.d/conda.sh" &&& conda activate v3 &n& cd 
/Users/pyw/new/MyRecall && python <<' "PY'. 
re.973039/1704913/40, 
File changes will appear he 
-0.13927313685417175, 
P 
0.04622427746653557, 
or the latest diffs are no long 
-0.007991696707904433, 
available 
-0.047124747186899185, 
0.83211686760187149, 
-8.010430477559566498, 
V. Success 
HATANTE upload_v1 BJ409: *ARAHTE-SUR (EEN, TERLOBith: E**-IE-BIBRE, WAIAV1t 
PJ 202. MERTHAX test_phase0_gates.py BS 19 gate EX, BESTENTERTATAB 
Thinking 
Ask for follow-up changes 
+ GPT-5.3-Codex Extra High V o- Plan 
Q 
Local V Full access V 
% master V 


-------------------


============================================================
Query: test
Time: 2026-02-06T19:50:52.548553
Candidates: 5
============================================================

--- [Doc #1] ---
[Metadata]
App: Codex
Title: Codex
Time: Friday, 2026-02-06 19:41

[Visual Context]
Scene: coding
Summary: The screen displays a development environment interface where a user is executing a phased testing process. The interface shows server/client logs indicating both are running, followed by Chinese text detailing an automated plan to run 8 pytest suites in sequence, with failure analysis. It logs commands that source a conda environment, activate 'v3', and run pytest tests on 'test_phase0_gates.py'. The output shows test collection and initial test names. The bottom includes an input field for follow-up changes and model configuration options. The user's intent is to systematically execute and validate a testing workflow.

[OCR Content]
- Execute Phase 0 fix-until-go process new 
Open V - Commit V 
E 
19:40:42 INFO openrecall.client I Capture interval: 20s 
Last turn changes V D 
19:40:42 INFO openrecall.client I Upload timeout: 180s 
19:40:42 INFO openrecall.client I Primary monitor only: True 
19:40:42 INFO openrecall.client I = 
19:40:42 INFO openrecall.client.consumer I : Consumer started I Pending uploads: 0 
19:40:42 INFO openrecall.client.recorder RE Recorder started (Producer-Consumer mode) 
NESEEDED (server/client ITTIAT). EGRAMEAT 8 A pytest, HREEAAR: EHTIEIN, ELTEIN 
RERTESTAL 
Ran source "$(conda info --base)/etc/protile. .d/conda. sh" &t& conda activate v3. && cd, Users/pyw/new/MyMyRecall &8&... 
Ran source "$(conda info -base)/etc/profile. .d/conda. .sh" && conda activate v3 && cd, Users/pyw/new/MyMyRecall &8&... 
Ran source "$(conda info -base)/etc/profile.d/conda. .sh" && conda activate v3 && cd, Users/pyw/new/MyMyRecall &8&... 
AU-A Phase 0 EUTLILILISSISI ALXTELLATILRSE5E DEER API smoke (XXHRASERE5HD4). 
Ran source "$(conda info --base)/etc/profile.d/conda.sh" && conda activate v3 && cd/Users/pyw/new/MyRecall.&&.... 
Ran source "$(conda info --base)/etc/profile.d/conda.sh" &t& conda activate v3 && cd/Users/pyw/new/MyRecall.&&... 
Ran source "$(conda info --base)/etc/profile.d/conda.sh" && conda activate v3 && cd/Users/pyw/new/MyRecall.&&... 
File changes will appear he 
Running command for 1s 
or the latest diffs are no long 
available 
bash 
$ source "$(conda info --base)/etc/profile.d/conda.sh" &f conda activate v3 &&& cd 
/Users/pyw/new/MyRecall &&& pytest tests/test_phase0_gates.py -V 
configfile: pytest.ini 
plugins: anyio-4.12.1 
collecting collected 19 items 
tests/test_phase0_gates.py::Te les Gat 01Sc ne igrati Success::test_gate_F01_schema_migration_suce 
tests/test_phase0_gates.py::Tes 0. 2 ackw war r ou mpat: ity::test_gate_F02_backward_compatibilit: 
Ask for follow-up changes 
+ GPT-5.3-Codex Extra High V o- Plan 
Q 
Local V Full access V 
% master V 


-------------------

--- [Doc #2] ---
[Metadata]
App: SmokeTestApp
Title: SmokeWindowV1
Time: Friday, 2026-02-06 19:43

[Visual Context]
Scene: general
Summary: 

[OCR Content]

-------------------

--- [Doc #3] ---
[Metadata]
App: SmokeTestApp
Title: SmokeWindow
Time: Friday, 2026-02-06 19:42

[Visual Context]
Scene: general
Summary: 

[OCR Content]

-------------------

--- [Doc #4] ---
[Metadata]
App: Google Chrome
Title: MyRecall
Time: Friday, 2026-02-06 19:04

[Visual Context]
Scene: coding
Summary: The screen shows the MyRecall application interface, which is a recall or memory assistant tool that captures and organizes browsing activity. The interface displays four recent activity cards, each timestamped and showing a screenshot of the user's browser state. Two activities are marked as 'Completed', one as 'Processing', and one as 'Pending'. The most recent card on the right shows a Google Gemini AI interface analyzing a document titled 'MyRecall-v3 Phase 0 计划深度解析'. The user's browser tab shows they are on a local server at '127.0.0.1:18083', indicating a development or testing environment.

[OCR Content]
MyRe X Xinm X Mode X Silico X Budg X Budg X Copil X - Goog X MiniM X HALYAL X RE X HTANE X NTANE X + 
< > 
127.0.0.1:18083 
A tA 
L 
p 
EB * Google Gemini GitHub LEERENTI ERYN.. D YouTube 09909 ( )P.. L& VIA Docs RaycastifilGZie (... **aL**WebV.. ChatGPT NotebookLM 
MyRecall 
BB III Q 
Completed 2 Processing 1 Pending 1 
Google Chrome 
2026-02-06 19:03:41 Google Chrome 
2026-02-06 19:03:20 Google Chrome 
2026-02-06 19:02:59 Google Chrome 
2026-02-06 19:02:37 
LE 
LE 
19:03 
: 
Pending... 
Processing... 
# The user is viewing the MyRecall application, 
* APIEELAGogle Gemini AIBIFEET* 
which is summarizing or analyzing a recent... 
F'MyRecall-v3 Phase 0 itXIRE# AAT'ENH, 


-------------------

--- [Doc #5] ---
[Metadata]
App: Codex
Title: Codex
Time: Friday, 2026-02-06 19:43

[Visual Context]
Scene: coding
Summary: The user is debugging a software issue in a coding environment, analyzing API test results that show inconsistencies between v1 and legacy endpoints (e.g., 405 and 400 errors). They've determined the problem is a testing API call mismatch, not a gate failure, and plan to use correct contracts to rerun tests. They also identified a 409 error from a duplicate timestamp in upload_v1 and plan to fix it by uploading with a unique timestamp and later extract gate definitions from test_phase0_gates.py to create a repair checklist. The interface shows executed commands, success indicators, and a thinking section for planning next steps.

[OCR Content]
- Execute Phase 0 fix-until-go process new 
Open V - Commit V 
E 
sers/pyw/ new/MyRecal da python << PY 
Last turn changes V D 
"json_object": true, 
"has_status_or_ok": true 
} 
}, 
i 
"name": "health_v1", 
Hurlu. "httn.//127 a a 1. 18 2082 V 11 h 
JS Success 
ANPRMEN***S: search HER 405, upload ixp 400, /memories/recent ANTENE v1/legacy Zith 
T-EX. F-SRAMENTH API X151111 MAXETSEBRMETATITEKERTASENRA 
Explored 3 files 
CMAXENBISHBE TEYAT gate AIk: search E GET, upload ME file+metadata o LAMHEA 
REVERENTAU, ##4108 legacy/v1 MSTERTE. 
Ran command for 4s 
bash 
$ source "$(conda info --base)/etc/profile.d/conda.sh" &&& conda activate v3 &n& cd 
/Users/pyw/new/MyRecall && python <<' "PY'. 
re.973039/1704913/40, 
File changes will appear he 
-0.13927313685417175, 
P 
0.04622427746653557, 
or the latest diffs are no long 
-0.007991696707904433, 
available 
-0.047124747186899185, 
0.83211686760187149, 
-8.010430477559566498, 
V. Success 
HATANTE upload_v1 BJ409: *ARAHTE-SUR (EEN, TERLOBith: E**-IE-BIBRE, WAIAV1t 
PJ 202. MERTHAX test_phase0_gates.py BS 19 gate EX, BESTENTERTATAB 
Thinking 
Ask for follow-up changes 
+ GPT-5.3-Codex Extra High V o- Plan 
Q 
Local V Full access V 
% master V 


-------------------
