============================= test session starts ==============================
platform darwin -- Python 3.9.6, pytest-8.4.2, pluggy-1.6.0 -- /Applications/Xcode.app/Contents/Developer/usr/bin/python3
cachedir: .pytest_cache
rootdir: /Users/pyw/new/MyRecall
configfile: pytest.ini
collecting ... collected 102 items / 11 errors

==================================== ERRORS ====================================
_________ ERROR collecting tests/test_phase1_5_focused_browser_url.py __________
ImportError while importing test module '/Users/pyw/new/MyRecall/tests/test_phase1_5_focused_browser_url.py'.
Hint: make sure your test modules/packages have valid Python names.
Traceback:
/Applications/Xcode.app/Contents/Developer/Library/Frameworks/Python3.framework/Versions/3.9/lib/python3.9/importlib/__init__.py:127: in import_module
    return _bootstrap._gcd_import(name[level:], package, level)
tests/test_phase1_5_focused_browser_url.py:8: in <module>
    from PIL import Image
E   ModuleNotFoundError: No module named 'PIL'
______________ ERROR collecting tests/test_phase1_5_ocr_engine.py ______________
ImportError while importing test module '/Users/pyw/new/MyRecall/tests/test_phase1_5_ocr_engine.py'.
Hint: make sure your test modules/packages have valid Python names.
Traceback:
/Applications/Xcode.app/Contents/Developer/Library/Frameworks/Python3.framework/Versions/3.9/lib/python3.9/importlib/__init__.py:127: in import_module
    return _bootstrap._gcd_import(name[level:], package, level)
tests/test_phase1_5_ocr_engine.py:8: in <module>
    from PIL import Image
E   ModuleNotFoundError: No module named 'PIL'
_____________ ERROR collecting tests/test_phase1_5_offset_guard.py _____________
ImportError while importing test module '/Users/pyw/new/MyRecall/tests/test_phase1_5_offset_guard.py'.
Hint: make sure your test modules/packages have valid Python names.
Traceback:
/Applications/Xcode.app/Contents/Developer/Library/Frameworks/Python3.framework/Versions/3.9/lib/python3.9/importlib/__init__.py:127: in import_module
    return _bootstrap._gcd_import(name[level:], package, level)
tests/test_phase1_5_offset_guard.py:6: in <module>
    from openrecall.server.video.processor import _validate_frame_offset
openrecall/server/video/processor.py:10: in <module>
    from openrecall.shared.config import settings
openrecall/shared/config.py:8: in <module>
    from pydantic import Field, model_validator, field_validator
E   ModuleNotFoundError: No module named 'pydantic'
______________ ERROR collecting tests/test_phase1_buffer_pool.py _______________
ImportError while importing test module '/Users/pyw/new/MyRecall/tests/test_phase1_buffer_pool.py'.
Hint: make sure your test modules/packages have valid Python names.
Traceback:
/Applications/Xcode.app/Contents/Developer/Library/Frameworks/Python3.framework/Versions/3.9/lib/python3.9/importlib/__init__.py:127: in import_module
    return _bootstrap._gcd_import(name[level:], package, level)
tests/test_phase1_buffer_pool.py:3: in <module>
    from openrecall.client.sck_stream import FrameBufferPool
openrecall/client/sck_stream.py:20: in <module>
    import mss
E   ModuleNotFoundError: No module named 'mss'
____________ ERROR collecting tests/test_phase1_frame_extractor.py _____________
ImportError while importing test module '/Users/pyw/new/MyRecall/tests/test_phase1_frame_extractor.py'.
Hint: make sure your test modules/packages have valid Python names.
Traceback:
/Applications/Xcode.app/Contents/Developer/Library/Frameworks/Python3.framework/Versions/3.9/lib/python3.9/importlib/__init__.py:127: in import_module
    return _bootstrap._gcd_import(name[level:], package, level)
tests/test_phase1_frame_extractor.py:9: in <module>
    import numpy as np
E   ModuleNotFoundError: No module named 'numpy'
_________________ ERROR collecting tests/test_phase1_gates.py __________________
ImportError while importing test module '/Users/pyw/new/MyRecall/tests/test_phase1_gates.py'.
Hint: make sure your test modules/packages have valid Python names.
Traceback:
/Applications/Xcode.app/Contents/Developer/Library/Frameworks/Python3.framework/Versions/3.9/lib/python3.9/importlib/__init__.py:127: in import_module
    return _bootstrap._gcd_import(name[level:], package, level)
tests/test_phase1_gates.py:16: in <module>
    from PIL import Image
E   ModuleNotFoundError: No module named 'PIL'
________ ERROR collecting tests/test_phase1_pipeline_profile_change.py _________
ImportError while importing test module '/Users/pyw/new/MyRecall/tests/test_phase1_pipeline_profile_change.py'.
Hint: make sure your test modules/packages have valid Python names.
Traceback:
/Applications/Xcode.app/Contents/Developer/Library/Frameworks/Python3.framework/Versions/3.9/lib/python3.9/importlib/__init__.py:127: in import_module
    return _bootstrap._gcd_import(name[level:], package, level)
tests/test_phase1_pipeline_profile_change.py:7: in <module>
    from openrecall.client.sck_stream import PixelFormatProfile, RawFrame
openrecall/client/sck_stream.py:20: in <module>
    import mss
E   ModuleNotFoundError: No module named 'mss'
_______________ ERROR collecting tests/test_phase1_retention.py ________________
ImportError while importing test module '/Users/pyw/new/MyRecall/tests/test_phase1_retention.py'.
Hint: make sure your test modules/packages have valid Python names.
Traceback:
/Applications/Xcode.app/Contents/Developer/Library/Frameworks/Python3.framework/Versions/3.9/lib/python3.9/importlib/__init__.py:127: in import_module
    return _bootstrap._gcd_import(name[level:], package, level)
tests/test_phase1_retention.py:9: in <module>
    from PIL import Image
E   ModuleNotFoundError: No module named 'PIL'
__________ ERROR collecting tests/test_phase1_sck_stride_unpadding.py __________
ImportError while importing test module '/Users/pyw/new/MyRecall/tests/test_phase1_sck_stride_unpadding.py'.
Hint: make sure your test modules/packages have valid Python names.
Traceback:
/Applications/Xcode.app/Contents/Developer/Library/Frameworks/Python3.framework/Versions/3.9/lib/python3.9/importlib/__init__.py:127: in import_module
    return _bootstrap._gcd_import(name[level:], package, level)
tests/test_phase1_sck_stride_unpadding.py:3: in <module>
    from openrecall.client.sck_stream import pack_bgra_plane, pack_nv12_planes
openrecall/client/sck_stream.py:20: in <module>
    import mss
E   ModuleNotFoundError: No module named 'mss'
__________ ERROR collecting tests/test_phase1_search_debug_render.py ___________
ImportError while importing test module '/Users/pyw/new/MyRecall/tests/test_phase1_search_debug_render.py'.
Hint: make sure your test modules/packages have valid Python names.
Traceback:
/Applications/Xcode.app/Contents/Developer/Library/Frameworks/Python3.framework/Versions/3.9/lib/python3.9/importlib/__init__.py:127: in import_module
    return _bootstrap._gcd_import(name[level:], package, level)
tests/test_phase1_search_debug_render.py:5: in <module>
    from openrecall.server.search.engine import SearchEngine
openrecall/server/search/engine.py:8: in <module>
    from openrecall.server.database.vector_store import VectorStore
openrecall/server/database/__init__.py:1: in <module>
    from .vector_store import VectorStore
openrecall/server/database/vector_store.py:4: in <module>
    import lancedb
E   ModuleNotFoundError: No module named 'lancedb'
______________ ERROR collecting tests/test_phase1_timeline_api.py ______________
ImportError while importing test module '/Users/pyw/new/MyRecall/tests/test_phase1_timeline_api.py'.
Hint: make sure your test modules/packages have valid Python names.
Traceback:
/Applications/Xcode.app/Contents/Developer/Library/Frameworks/Python3.framework/Versions/3.9/lib/python3.9/importlib/__init__.py:127: in import_module
    return _bootstrap._gcd_import(name[level:], package, level)
tests/test_phase1_timeline_api.py:10: in <module>
    from PIL import Image
E   ModuleNotFoundError: No module named 'PIL'
=========================== short test summary info ============================
ERROR tests/test_phase1_5_focused_browser_url.py
ERROR tests/test_phase1_5_ocr_engine.py
ERROR tests/test_phase1_5_offset_guard.py
ERROR tests/test_phase1_buffer_pool.py
ERROR tests/test_phase1_frame_extractor.py
ERROR tests/test_phase1_gates.py
ERROR tests/test_phase1_pipeline_profile_change.py
ERROR tests/test_phase1_retention.py
ERROR tests/test_phase1_sck_stride_unpadding.py
ERROR tests/test_phase1_search_debug_render.py
ERROR tests/test_phase1_timeline_api.py
!!!!!!!!!!!!!!!!!!! Interrupted: 11 errors during collection !!!!!!!!!!!!!!!!!!!
============================== 11 errors in 0.35s ==============================
